{
  "type": "parcours",
  "identifiant": "welcome-reseau",
  "version": "0.1.0",
  "sources": [
    {
      "source_id": "starter-welcome-reseau",
      "source_type": "starter",
      "source_fichier": "sources/starters/welcome-reseau/",
      "source_note": "Parcours Welcome Réseau numérisé (4 paliers)."
    }
  ],
  "provenance": {
    "date_extraction": "2026-07-06",
    "methode": "numerisation manuelle ; QCM fusionnes avec les corriges",
    "point_entree": "starter"
  },
  "niveau_classe": {
    "code": "2TNE",
    "intitule": "Seconde professionnelle TNE, spécialité CIEL"
  },
  "titre": "Semaine réseau et virtualisation",
  "organisation": {
    "activite_glissante": true,
    "ordre_impose": true
  },
  "paliers": [
    {
      "id": "palier-1",
      "ordre": 1,
      "titre": "Fabriquer et tester un câble Ethernet droit T568B",
      "theme": "Câble Ethernet droit",
      "production_attendue": "Un câble droit conforme",
      "dossier_technique": {
        "titre": "Dossier technique",
        "ressources": [
          {
            "type": "markdown",
            "titre": "Dossier technique",
            "ordre": 1,
            "fichier": "palier-1/dossier-technique.md"
          }
        ]
      },
      "qcm": {
        "id": "qcm-palier-1",
        "format_reponse": "Pour chaque question, choisir une seule réponse.",
        "validation": {
          "seuil": "100%"
        },
        "questions": [
          {
            "numero": 1,
            "enonce": "À quoi sert principalement un câble Ethernet RJ45 ?",
            "choix": [
              {
                "lettre": "A",
                "texte": "À installer un système d’exploitation"
              },
              {
                "lettre": "B",
                "texte": "À relier physiquement un équipement au réseau"
              },
              {
                "lettre": "C",
                "texte": "À créer une adresse IP"
              }
            ],
            "bonne_reponse": "B"
          },
          {
            "numero": 2,
            "enonce": "Dans une salle informatique, le câble RJ45 est souvent utilisé car il est :",
            "choix": [
              {
                "lettre": "A",
                "texte": "plus stable qu’une liaison Wi-Fi pour les postes fixes"
              },
              {
                "lettre": "B",
                "texte": "plus rapide à fabriquer qu’une clé USB"
              },
              {
                "lettre": "C",
                "texte": "obligatoire pour ouvrir une session Windows"
              }
            ],
            "bonne_reponse": "A"
          },
          {
            "numero": 3,
            "enonce": "Un réseau local peut correspondre à :",
            "choix": [
              {
                "lettre": "A",
                "texte": "une salle informatique ou une entreprise"
              },
              {
                "lettre": "B",
                "texte": "uniquement Internet"
              },
              {
                "lettre": "C",
                "texte": "uniquement un ordinateur seul"
              }
            ],
            "bonne_reponse": "A"
          },
          {
            "numero": 4,
            "enonce": "La connexion physique concerne :",
            "choix": [
              {
                "lettre": "A",
                "texte": "l’adresse IP et le DNS"
              },
              {
                "lettre": "B",
                "texte": "le câble, le connecteur, la carte réseau et le switch"
              },
              {
                "lettre": "C",
                "texte": "le nom de l’utilisateur"
              }
            ],
            "bonne_reponse": "B"
          },
          {
            "numero": 5,
            "enonce": "La configuration logique concerne principalement :",
            "choix": [
              {
                "lettre": "A",
                "texte": "l’adresse IP, le masque, la passerelle et le DNS"
              },
              {
                "lettre": "B",
                "texte": "la couleur des fils du câble"
              },
              {
                "lettre": "C",
                "texte": "la pince à sertir"
              }
            ],
            "bonne_reponse": "A"
          },
          {
            "numero": 6,
            "enonce": "Un câble Ethernet contient généralement :",
            "choix": [
              {
                "lettre": "A",
                "texte": "2 fils"
              },
              {
                "lettre": "B",
                "texte": "4 fils"
              },
              {
                "lettre": "C",
                "texte": "8 fils"
              }
            ],
            "bonne_reponse": "C"
          },
          {
            "numero": 7,
            "enonce": "Les 8 fils d’un câble Ethernet sont organisés en :",
            "choix": [
              {
                "lettre": "A",
                "texte": "2 paires torsadées"
              },
              {
                "lettre": "B",
                "texte": "4 paires torsadées"
              },
              {
                "lettre": "C",
                "texte": "8 paires torsadées"
              }
            ],
            "bonne_reponse": "B"
          },
          {
            "numero": 8,
            "enonce": "Le rôle principal des paires torsadées est de :",
            "choix": [
              {
                "lettre": "A",
                "texte": "réduire les perturbations électriques"
              },
              {
                "lettre": "B",
                "texte": "rendre le câble plus coloré"
              },
              {
                "lettre": "C",
                "texte": "empêcher l’installation de Windows"
              }
            ],
            "bonne_reponse": "A"
          },
          {
            "numero": 9,
            "enonce": "Le connecteur RJ45 possède :",
            "choix": [
              {
                "lettre": "A",
                "texte": "4 broches"
              },
              {
                "lettre": "B",
                "texte": "6 broches"
              },
              {
                "lettre": "C",
                "texte": "8 broches"
              }
            ],
            "bonne_reponse": "C"
          },
          {
            "numero": 10,
            "enonce": "Pourquoi faut-il respecter un ordre précis des fils dans le connecteur RJ45 ?",
            "choix": [
              {
                "lettre": "A",
                "texte": "Pour que le câble soit plus joli"
              },
              {
                "lettre": "B",
                "texte": "Pour que les broches correspondent correctement"
              },
              {
                "lettre": "C",
                "texte": "Pour que le câble devienne plus long"
              }
            ],
            "bonne_reponse": "B"
          },
          {
            "numero": 11,
            "enonce": "Dans cette activité, la norme utilisée est :",
            "choix": [
              {
                "lettre": "A",
                "texte": "T568A"
              },
              {
                "lettre": "B",
                "texte": "T568B"
              },
              {
                "lettre": "C",
                "texte": "USB-C"
              }
            ],
            "bonne_reponse": "B"
          },
          {
            "numero": 12,
            "enonce": "En norme T568B, la broche 1 correspond au fil :",
            "choix": [
              {
                "lettre": "A",
                "texte": "blanc-orange"
              },
              {
                "lettre": "B",
                "texte": "bleu"
              },
              {
                "lettre": "C",
                "texte": "marron"
              }
            ],
            "bonne_reponse": "A"
          },
          {
            "numero": 13,
            "enonce": "En norme T568B, la broche 2 correspond au fil :",
            "choix": [
              {
                "lettre": "A",
                "texte": "vert"
              },
              {
                "lettre": "B",
                "texte": "orange"
              },
              {
                "lettre": "C",
                "texte": "blanc-bleu"
              }
            ],
            "bonne_reponse": "B"
          },
          {
            "numero": 14,
            "enonce": "En norme T568B, la broche 6 correspond au fil :",
            "choix": [
              {
                "lettre": "A",
                "texte": "vert"
              },
              {
                "lettre": "B",
                "texte": "blanc-marron"
              },
              {
                "lettre": "C",
                "texte": "bleu"
              }
            ],
            "bonne_reponse": "A"
          },
          {
            "numero": 15,
            "enonce": "Un câble droit est un câble dont :",
            "choix": [
              {
                "lettre": "A",
                "texte": "les deux extrémités sont câblées de la même manière"
              },
              {
                "lettre": "B",
                "texte": "les deux extrémités utilisent forcément deux normes différentes"
              },
              {
                "lettre": "C",
                "texte": "les fils sont tous retirés de la gaine"
              }
            ],
            "bonne_reponse": "A"
          },
          {
            "numero": 16,
            "enonce": "Pour fabriquer un câble droit en T568B, il faut câbler :",
            "choix": [
              {
                "lettre": "A",
                "texte": "T568A d’un côté et T568B de l’autre"
              },
              {
                "lettre": "B",
                "texte": "T568B d’un côté et T568B de l’autre"
              },
              {
                "lettre": "C",